{
  "catalogDigest": "sha256:a3d23879b39b36e3ab80cee6846f4a6e7866bfe3589f650bc72ad92e2b182788",
  "compilerVersion": "1.0.0",
  "presets": [
    {
      "definition": {
        "apiVersion": "nemoclaw.nvidia.com/managed-inference/v1",
        "kind": "ServingPreset",
        "metadata": {
          "displayName": "DeepSeek V4 Flash 0731 on two DGX Sparks",
          "id": "vllm.dgx-spark-gb10.dual.deepseek-v4-flash-0731"
        },
        "spec": {
          "plan": {
            "backend": "vllm",
            "bindings": {
              "sparkTopology": {
                "valueFromTopologyQualification": {
                  "id": "dgx-spark.gb10.dual-cx7",
                  "output": "topology",
                  "schemaVersion": 1
                }
              }
            },
            "recipeRef": "vllm.deepseek-v4-flash-0731.spark-dual.v1"
          },
          "requirements": {
            "all": [
              {
                "readiness": {
                  "id": "host.platform.dgx_spark",
                  "kind": "qualification",
                  "scope": "everyNode",
                  "status": "qualified"
                }
              },
              {
                "fact": "cluster.nodeCount",
                "operator": "equals",
                "state": "present",
                "value": 2
              },
              {
                "topologyQualification": {
                  "id": "dgx-spark.gb10.dual-cx7",
                  "schemaVersion": 1,
                  "status": "qualified"
                }
              }
            ]
          },
          "selection": "automatic"
        }
      },
      "definitionDigest": "sha256:ab115dd1842489f0eb64aa54e26b4ef2d8ff8e5725fa5b3af84398d31ff2f523",
      "sourceFile": "managed-inference/presets/vllm.dgx-spark-gb10.dual.deepseek-v4-flash-0731.yaml"
    }
  ],
  "recipes": [
    {
      "definition": {
        "apiVersion": "nemoclaw.nvidia.com/managed-inference/v1",
        "kind": "ServingRecipe",
        "metadata": {
          "displayName": "DeepSeek V4 Flash 0731 on two DGX Sparks",
          "id": "vllm.deepseek-v4-flash-0731.spark-dual.v1"
        },
        "spec": {
          "backend": "vllm",
          "bindings": {
            "sparkTopology": {
              "outputSchema": "nemoclaw.nvidia.com/dual-spark-topology/v1",
              "qualificationId": "dgx-spark.gb10.dual-cx7",
              "schemaVersion": 1,
              "type": "topologyQualificationOutput"
            }
          },
          "execution": {
            "distributedExecutorBackend": "mp",
            "lifecycleRef": "vllm.dual-dgx-spark/v1",
            "materializerRef": "vllm.dual-dgx-spark/v1",
            "nodeCount": 2,
            "pipelineParallelSize": 1,
            "tensorParallelSize": 2,
            "topologyBinding": "sparkTopology"
          },
          "model": {
            "downloadSizeBytes": 166898661074,
            "encodingPath": "encoding/encoding_dsv4.py",
            "id": "deepseek-ai/DeepSeek-V4-Flash-0731",
            "preparationRef": "deepseek-v4-flash-0731/v1",
            "revision": "9e165c30e2704aec5d9d593cce3eebd58bbef1cb",
            "servedName": "deepseek-v4-flash-0731"
          },
          "readiness": {
            "expectedModel": "deepseek-v4-flash-0731",
            "timeoutSeconds": 3600
          },
          "runtime": {
            "architecture": "arm64",
            "devices": [
              "/dev/infiniband"
            ],
            "environment": {
              "CUTE_DSL_ARCH": "sm_121a",
              "DG_JIT_NVCC_COMPILER": "/usr/local/cuda/bin/nvcc",
              "DG_JIT_USE_NVRTC": "0",
              "FLASHINFER_CUDA_ARCH_LIST": "12.1a",
              "FLASHINFER_DISABLE_VERSION_CHECK": "1",
              "FLASHINFER_WORKSPACE_BASE": "/cache/huggingface/flashinfer",
              "HF_HOME": "/cache/huggingface",
              "HF_HUB_DISABLE_XET": "1",
              "HF_HUB_OFFLINE": "1",
              "NCCL_CROSS_NIC": "1",
              "NCCL_CUMEM_ENABLE": "0",
              "NCCL_DEBUG": "WARN",
              "NCCL_IB_DISABLE": "0",
              "NCCL_IGNORE_CPU_AFFINITY": "1",
              "NCCL_NET": "IB",
              "NCCL_NVLS_ENABLE": "0",
              "PYTORCH_CUDA_ALLOC_CONF": "expandable_segments:True",
              "TILELANG_CLEANUP_TEMP_FILES": "1",
              "TORCH_CUDA_ARCH_LIST": "12.1a",
              "TRANSFORMERS_OFFLINE": "1",
              "VLLM_ALLOW_LONG_MAX_MODEL_LEN": "1",
              "VLLM_B12X_W4A16_FORCE_BLOCKS_MAX_M": "16",
              "VLLM_B12X_W4A16_FORCE_BLOCKS_PER_SM": "0",
              "VLLM_CACHE_ROOT": "/cache/huggingface/vllm-cache",
              "VLLM_MEMORY_PROFILER_ESTIMATE_CUDAGRAPHS": "0",
              "VLLM_SPARSE_INDEXER_MAX_LOGITS_MB": "256",
              "VLLM_USE_B12X_MOE": "1",
              "VLLM_USE_BREAKABLE_CUDAGRAPH": "0",
              "VLLM_USE_FLASHINFER_SAMPLER": "1"
            },
            "image": "ghcr.io/anemll/dspark-vllm-gx10@sha256:a83948492cf13df455170fb42885f5ef4db54fefe0feff0f841ecbff464ac9d8",
            "imageDownloadSizeBytes": 9787537825,
            "ipcMode": "host",
            "networkMode": "host",
            "sharedMemoryBytes": 68719476736
          },
          "serve": {
            "arguments": [
              {
                "name": "--port",
                "value": 8000
              },
              {
                "name": "--trust-remote-code"
              },
              {
                "name": "--kv-cache-dtype",
                "value": "nvfp4_ds_mla"
              },
              {
                "name": "--block-size",
                "value": 256
              },
              {
                "name": "--max-model-len",
                "value": 1048576
              },
              {
                "name": "--max-num-seqs",
                "value": 6
              },
              {
                "name": "--max-num-batched-tokens",
                "value": 8192
              },
              {
                "name": "--max-cudagraph-capture-size",
                "value": 36
              },
              {
                "name": "--gpu-memory-utilization",
                "value": 0.8
              },
              {
                "name": "--enable-prefix-caching"
              },
              {
                "name": "--enable-prompt-tokens-details"
              },
              {
                "name": "--async-scheduling"
              },
              {
                "name": "--enable-chunked-prefill"
              },
              {
                "name": "--speculative-config",
                "value": "{\"method\":\"dspark\",\"num_speculative_tokens\":5,\"draft_sample_method\":\"probabilistic\"}"
              },
              {
                "name": "--tokenizer-mode",
                "value": "deepseek_v4"
              },
              {
                "name": "--moe-backend",
                "value": "flashinfer_b12x"
              },
              {
                "name": "--tool-call-parser",
                "value": "deepseek_v4"
              },
              {
                "name": "--enable-auto-tool-choice"
              },
              {
                "name": "--reasoning-parser",
                "value": "deepseek_v4"
              },
              {
                "name": "--reasoning-config",
                "value": "{\"reasoning_parser\":\"deepseek_v4\",\"reasoning_start_str\":\"<think>\",\"reasoning_end_str\":\"</think>\"}"
              },
              {
                "name": "--default-chat-template-kwargs",
                "value": "{\"thinking\":true,\"reasoning_effort\":\"low\"}"
              },
              {
                "name": "--generation-config",
                "value": "vllm"
              },
              {
                "name": "--enable-flashinfer-autotune"
              }
            ],
            "authentication": "bearer"
          }
        }
      },
      "definitionDigest": "sha256:9ff596013e4e4bb6d22ead3aff23917437239e0bcfbf7f8af79e27f5ec908f0f",
      "sourceFile": "managed-inference/recipes/vllm.deepseek-v4-flash-0731.spark-dual.v1.yaml"
    }
  ],
  "schemaVersion": "1.0.0",
  "sourceFiles": [
    {
      "digest": "sha256:e0c4c3a6f175d1ce65bdc1f7d8d4b59247909e884949110628017d7b4adb85a8",
      "path": "managed-inference/presets/vllm.dgx-spark-gb10.dual.deepseek-v4-flash-0731.yaml"
    },
    {
      "digest": "sha256:1dda2fbb6358718dcb718adfb836d43f4dc7bf446f196794e8f9a2dc95087802",
      "path": "managed-inference/recipes/vllm.deepseek-v4-flash-0731.spark-dual.v1.yaml"
    }
  ],
  "sourceRevision": "sha256:d7a897e9b3424f44aa0662a0452da2921686ee3f6779fd0b2d0e858b5625b328"
}
